City,Attraction,Latitude,Longitude,Description
Zagreb,Zagreb Cathedral,45.8144,15.9792,Gothic cathedral and tallest building in Croatia.
Zagreb,St. Mark's Church,45.8164,15.9739,Church famous for its colorful tiled roof.
Zagreb,Upper Town,45.815,15.9733,Historic medieval core of Zagreb (Gradec).
Zagreb,Ban Jelacic Square,45.8131,15.9772,The central square and meeting point of the city.
Zagreb,Maksimir Park,45.8242,16.0189,Oldest public park in South East Europe.
Zagreb,Museum of Broken Relationships,45.815,15.9731,Unique museum dedicated to failed love stories.
Zagreb,Dolac Market,45.8139,15.9775,The main open-air farmers market.
Zagreb,Lotrščak Tower,45.8144,15.9733,13th-century tower with a daily cannon shot.
Zagreb,Zrinjevac Park,45.8106,15.9783,Park with a music pavilion and fountains.
Zagreb,Mimara Museum,45.8086,15.9678,Art museum housing the collection of Wiltrud and Ante Mimara.
